Reading OpenROAD database at '/mnt/c/Data/IEEE/32Bit-ALU/pd/runs/RUN_2026-01-21_11-02-25/38-openroad-globalrouting/ALU.odb'…
Reading library file at '/home/diddy/.ciel/ciel/sky130/versions/0fe599b2afb6708d281543108caf8310912f54af/sky130A/libs.ref/sky130_fd_sc_hd/lib/sky130_fd_sc_hd__tt_025C_1v80.lib'…
Reading design constraints file at '/nix/store/ifgrnqkf6pcsk2qzdn5bai2rvd4skbbc-python3-3.11.9-env/lib/python3.11/site-packages/librelane/scripts/base.sdc'…
[INFO] Using clock clk…
[INFO] Setting output delay to: 4.0
[INFO] Setting input delay to: 4.0
[INFO] Setting load to: 0.033442
[INFO] Setting clock uncertainty to: 0.25
[INFO] Setting clock transition to: 0.1499999999999999944488848768742172978818416595458984375
[INFO] Setting timing derate to: 5%
[INFO] Setting signal min routing layer to: met1 and clock min routing layer to met1. 
[INFO] Setting signal max routing layer to: met5 and clock max routing layer to met5. 
-congestion_iterations 50 -verbose
[INFO GRT-0020] Min routing layer: met1
[INFO GRT-0021] Max routing layer: met5
[INFO GRT-0022] Global adjustment: 30%
[INFO GRT-0023] Grid origin: (0, 0)
[INFO GRT-0043] No OR_DEFAULT vias defined.
[INFO GRT-0088] Layer li1     Track-Pitch = 0.4600  line-2-Via Pitch: 0.3400
[INFO GRT-0088] Layer met1    Track-Pitch = 0.3400  line-2-Via Pitch: 0.3400
[INFO GRT-0088] Layer met2    Track-Pitch = 0.4600  line-2-Via Pitch: 0.3500
[INFO GRT-0088] Layer met3    Track-Pitch = 0.6800  line-2-Via Pitch: 0.6150
[INFO GRT-0088] Layer met4    Track-Pitch = 0.9200  line-2-Via Pitch: 1.0400
[INFO GRT-0088] Layer met5    Track-Pitch = 3.4000  line-2-Via Pitch: 3.1100
[INFO GRT-0019] Found 27 clock nets.
[INFO GRT-0001] Minimum degree: 2
[INFO GRT-0002] Maximum degree: 27
[INFO GRT-0003] Macros: 0
[INFO GRT-0043] No OR_DEFAULT vias defined.
[INFO GRT-0004] Blockages: 4621

[INFO GRT-0053] Routing resources analysis:
          Routing      Original      Derated      Resource
Layer     Direction    Resources     Resources    Reduction (%)
---------------------------------------------------------------
li1        Vertical            0             0          0.00%
met1       Horizontal      46443         22450          51.66%
met2       Vertical        35212         22887          35.00%
met3       Horizontal      23198         15624          32.65%
met4       Vertical        14222          8344          41.33%
met5       Horizontal       4602          2162          53.02%
---------------------------------------------------------------

[INFO GRT-0101] Running extra iterations to remove overflow.
[INFO GRT-0197] Via related to pin nodes: 30691
[INFO GRT-0198] Via related Steiner nodes: 486
[INFO GRT-0199] Via filling finished.
[INFO GRT-0111] Final number of vias: 38016
[INFO GRT-0112] Final usage 3D: 135015

[INFO GRT-0096] Final congestion report:
Layer         Resource        Demand        Usage (%)    Max H / Max V / Total Overflow
---------------------------------------------------------------------------------------
li1                  0             0            0.00%             0 /  0 /  0
met1             22450          9579           42.67%             0 /  0 /  0
met2             22887          9343           40.82%             0 /  0 /  0
met3             15624          1220            7.81%             0 /  0 /  0
met4              8344           825            9.89%             0 /  0 /  0
met5              2162             0            0.00%             0 /  0 /  0
---------------------------------------------------------------------------------------
Total            71467         20967           29.34%             0 /  0 /  0

[INFO GRT-0018] Total wirelength: 229666 um
[INFO GRT-0014] Routed nets: 5765
[INFO GRT-0006] Repairing antennas, iteration 1.
[INFO GRT-0043] No OR_DEFAULT vias defined.
[INFO GRT-0012] Found 15 antenna violations.
[INFO GRT-0015] Inserted 22 diodes.
[INFO GRT-0009] rerouting 1502 nets.
[INFO GRT-0001] Minimum degree: 2
[INFO GRT-0002] Maximum degree: 27
[INFO GRT-0006] Repairing antennas, iteration 2.
[INFO GRT-0043] No OR_DEFAULT vias defined.
[INFO GRT-0012] Found 5 antenna violations.
[INFO GRT-0015] Inserted 5 diodes.
[INFO GRT-0009] rerouting 11 nets.
[INFO GRT-0001] Minimum degree: 3
[INFO GRT-0002] Maximum degree: 12
[INFO GRT-0006] Repairing antennas, iteration 3.
[INFO GRT-0043] No OR_DEFAULT vias defined.
[INFO GRT-0012] Found 0 antenna violations.
Placement Analysis
---------------------------------
total displacement          0.0 u
average displacement        0.0 u
max displacement            0.0 u
original HPWL          134531.2 u
legalized HPWL         134531.2 u
delta HPWL                    0 %

[INFO DPL-0020] Mirrored 2358 instances
[INFO DPL-0021] HPWL before          134531.2 u
[INFO DPL-0022] HPWL after           131033.6 u
[INFO DPL-0023] HPWL delta               -2.6 %
-congestion_iterations 50 -verbose
[INFO GRT-0020] Min routing layer: met1
[INFO GRT-0021] Max routing layer: met5
[INFO GRT-0022] Global adjustment: 30%
[INFO GRT-0023] Grid origin: (0, 0)
[INFO GRT-0043] No OR_DEFAULT vias defined.
[INFO GRT-0088] Layer li1     Track-Pitch = 0.4600  line-2-Via Pitch: 0.3400
[INFO GRT-0088] Layer met1    Track-Pitch = 0.3400  line-2-Via Pitch: 0.3400
[INFO GRT-0088] Layer met2    Track-Pitch = 0.4600  line-2-Via Pitch: 0.3500
[INFO GRT-0088] Layer met3    Track-Pitch = 0.6800  line-2-Via Pitch: 0.6150
[INFO GRT-0088] Layer met4    Track-Pitch = 0.9200  line-2-Via Pitch: 1.0400
[INFO GRT-0088] Layer met5    Track-Pitch = 3.4000  line-2-Via Pitch: 3.1100
[INFO GRT-0019] Found 27 clock nets.
[INFO GRT-0001] Minimum degree: 2
[INFO GRT-0002] Maximum degree: 27
[INFO GRT-0003] Macros: 0
[INFO GRT-0043] No OR_DEFAULT vias defined.
[INFO GRT-0004] Blockages: 4621

[INFO GRT-0053] Routing resources analysis:
          Routing      Original      Derated      Resource
Layer     Direction    Resources     Resources    Reduction (%)
---------------------------------------------------------------
li1        Vertical            0             0          0.00%
met1       Horizontal      46443         22450          51.66%
met2       Vertical        35212         22887          35.00%
met3       Horizontal      23198         15624          32.65%
met4       Vertical        14222          8344          41.33%
met5       Horizontal       4602          2162          53.02%
---------------------------------------------------------------

[INFO GRT-0101] Running extra iterations to remove overflow.
[INFO GRT-0197] Via related to pin nodes: 30718
[INFO GRT-0198] Via related Steiner nodes: 487
[INFO GRT-0199] Via filling finished.
[INFO GRT-0111] Final number of vias: 38044
[INFO GRT-0112] Final usage 3D: 135115

[INFO GRT-0096] Final congestion report:
Layer         Resource        Demand        Usage (%)    Max H / Max V / Total Overflow
---------------------------------------------------------------------------------------
li1                  0             0            0.00%             0 /  0 /  0
met1             22450          9607           42.79%             0 /  0 /  0
met2             22887          9345           40.83%             0 /  0 /  0
met3             15624          1203            7.70%             0 /  0 /  0
met4              8344           828            9.92%             0 /  0 /  0
met5              2162             0            0.00%             0 /  0 /  0
---------------------------------------------------------------------------------------
Total            71467         20983           29.36%             0 /  0 /  0

[INFO GRT-0018] Total wirelength: 229894 um
[INFO GRT-0014] Routed nets: 5765
[INFO] Setting RC values…
Setting global connections for newly added cells…
[INFO] Setting global connections...
Updating metrics…
Cell type report:                       Count       Area
  Fill cell                               234     878.34
  Tap cell                               1428    1786.71
  Antenna cell                             27      67.56
  Clock buffer                             27     399.13
  Timing Repair Buffer                    722    4853.40
  Inverter                                415    1557.74
  Clock inverter                           21     352.84
  Sequential cell                         314    8012.68
  Multi-Input combinational cell         4220   31816.76
  Total                                  7408   49725.19
Writing OpenROAD database to '/mnt/c/Data/IEEE/32Bit-ALU/pd/runs/RUN_2026-01-21_11-02-25/41-openroad-repairantennas/1-diodeinsertion/ALU.odb'…
Writing layout to '/mnt/c/Data/IEEE/32Bit-ALU/pd/runs/RUN_2026-01-21_11-02-25/41-openroad-repairantennas/1-diodeinsertion/ALU.def'…
